Title;Original Title;Synopsis;Genre;Release Date
Pale Moon;紙の月;"Rika Umezawa vive com seu marido e sem filhos. Ela possui um trabalho de meio período em um banco, sendo elogiada pelos clientes e chefe, devido à atenção que dá a seus afazeres. Ainda assim, ela sente um vazio por parte do marido, que não parece interessado nela. Rika acaba se envolvendo em um caso extraconjugal com um jovem chamado Kota, e começa a extorquir seus clientes. Baseado no livro ""Kami no Tsuki"".";Crime,Drama;2014-11-15
A Saga Crepúsculo: Lua Nova;The Twilight Saga: New Moon;Logo após Bella Swan completar 18 anos, Edward Cullen decide deixá-la para trás em um esforço para protegê-la após um ataque que quase tirou sua vida. Com uma tristeza inconsolável, Bella descobre que ela pode chamar a imagem de Edward sempre que se coloca em perigo e seu desejo em estar com ele a leva a assumir riscos cada vez maiores. Com a ajuda de Jacob Black, seu amigo de infância e um membro da misteriosa tripo Quileute, o coração de Bella vai gradualmente descongelando, enquanto Jacob esconde seu próprio segredo sobrenatural. Ao receber a notícia de que seu amado decide acabar com a própria vida, Bella parte para impedi-lo, sem imaginar que um perigo ainda maior a aguarda.;Aventura,Drama,Fantasia,Romance;2009-11-18
Rebel Moon - Parte 2: A Marcadora de Cicatrizes;Rebel Moon - Part Two: The Scargiver;Part two of Zack Snyder's 2023 sci-fi epic, Rebel Moon.;Ação,Drama,Ficção Científica;2024-04-19
Moon Young;문영;Moon-young é uma garota muda, que sempre tem em mãos uma pequena filmadora para filmar secretamente o rosto das pessoas. Após uma série de conflitos com seu pai bêbado, ela sai correndo de casa e encontra Hee-soo em lágrimas, terminando com seu namorado. Gradualmente, uma relação entre elas se inicia.;Drama;2017-01-12
Lua de Fel;Bitter Moon;Um casal de ingleses ao fazerem um cruzeiro, conhecem uma bela e jovem francesa casada com um cadeirante. Ao notar o interesse por sua esposa, o cadeirante conta como eles se conheceram e se amaram loucamente.;Drama,Romance,Suspense;1992-09-02
Lunar;Moon;O turno de três anos do astronauta Sam Bell em uma mina lunar está finalmente terminando e ele está ansioso para seu reencontro com sua esposa e sua filha. De repente, a saúde de Sam dá uma guinada para pior. Ele sofre dores de cabeça e alucinações e quase tem um acidente fatal. Ele conhece o que parece ser uma versão mais jovem de si mesmo, possivelmente um clone. Sam precisa resolver o mistério antes que a tripulação da empresa chegue.;Drama,Ficção Científica;2009-06-12
Pretty Guardian Sailor Moon Cosmos: O Filme (Parte 2);劇場版 美少女戦士セーラームーンCosmos 後編;A saga de Sailor Moon chega ao seu clímax, com a luta final contra a Shadow Galactica.;Animação;2023-06-30
Pink Floyd: The Dark Side of the Moon;Pink Floyd - The Making of The Dark Side of the Moon;"Lançado para coincidir com o então 30º aniversário deste álbum clássico. Aprenda como Pink Floyd montou ""The Dark Side of the Moon"" com a ajuda do engenheiro original Alan Parsons. Todos os quatro membros da banda (Roger Waters, David Gilmour, Nick Mason e Richard Wright) são entrevistados em profundidade, dando informações valiosas sobre o processo de gravação. Os temas do álbum são discutidos em detalhes e a banda leva você de volta às fitas originais para ilustrar como eles compilaram as músicas. Com performances individuais de certas faixas de Roger, David e Richard incluídas, essa é uma aquisição essencial para qualquer fã do Pink Floyd e um artefato fascinante para historiadores do rock em todos os lugares do mundo.";Documentário,Musical;2003-06-01
Sailor Moon - Make Up! Sailor Senshi;メイクアップ！セーラー戦士;Usagi and Chibiusa overhear two girls talking about the Sailor Senshi and Tuxedo Mask. Humorously, as the girls discuss which is the smartest, most elegant, strongest, and the leader of the Senshi, Usagi claims those titles for herself. Chibiusa shakes her head at Usagi's delusion.;Animação,Comédia;1993-12-05
Mona Lisa e a Lua de Sangue;Mona Lisa and the Blood Moon;Uma garota com poderes incomuns está internada em um hospital psiquiátrico há mais de uma década até que, uma noite, a lua de sangue a libera e ela pode se reinserir na moderna cidade de Nova Orleans, onde enfrentará estranhos habitantes. Ele será capaz de encontrar seu lugar neste mundo?;Fantasia,Mistério,Suspense;2022-09-30
O Homem da Terra;The Man from Earth;A obra se concentra no misterioso comportamento de John Oldman (David Lee Smith), um professor acadêmico que a cada dez anos muda de contexto, deixando tudo para trás. Cansado de guardar esse misterioso segredo, antes de partir, convida seus colegas de academia para uma reunião em sua casa onde irá revelar pela primeira vez o que está por trás desse comportamento obscuro.;Drama,Ficção Científica;2007-06-10
O Homem da Terra: Holoceno;The Man from Earth: Holocene;"O filme conta a história de um professor de ""Homem da Terra"" de 15 mil anos, John Oldman, que ensina no norte da Califórnia, ao perceber que não só ele finalmente começa a envelhecer, mas quatro estudantes descobriram seu segredo mais profundo.";Drama,Ficção Científica;2017-10-13
O Último Homem da Face da Terra;El último hombre sobre la Tierra;Uma executiva sofisticada descobre que todas as pessoas desapareceram. Para piorar, só sobrou um colega de trabalho arrogante que está determinado a conquistá-la.;Comédia;2022-12-22
O Homem Que Caiu na Terra;The Man Who Fell to Earth;Thomas Jerome Newton (David Bowie) é um alienígena que vem à Terra em busca da salvação de seu planeta: água. Disfarçado de empresário, ele faz uso de tecnologias avançadas para conseguir o dinheiro necessário para a construção da nave que o levará de volta para casa. Para isso, no entanto, ele deverá sobreviver à dura competição do mundo dos negócios e às tentações terráqueas.;Drama,Ficção Científica;1976-03-18
Frankenstein: Entre Anjos e Demônios;I, Frankenstein;Após enterrar o Dr. Victor Frankenstein, o monstro criado por ele é atacado por demônios, que pretendem capturá-lo. Ele consegue se salvar e segue sua vida. Porém, 200 anos depois, o monstro, agora com o nome de Adam, acaba se envolvendo em uma guerra entre dois clãs imortais na cidade ancestral de Darkhaven.;Horror,Suspense;2014-01-22
O Jovem Frankenstein;Young Frankenstein;Chamado ao castelo de seu finado avô na Transilvânia, o jovem Dr. Frankestein logo descobre um manual descrevendo passo a passo como trazer um cadáver de volta à vida. Auxiliado pelo corcunda Igor e pela curvilínea Inga, ele cria um monstro que só deseja ser amado.;Comédia;1974-12-15
Frankenstein de Mary Shelley;Mary Shelley's Frankenstein;Quando o brilhante, mas heterodoxo cientista Dr. Victor Frankenstein rejeita o homem artificial que acabou de criar, a Criatura escapa e jura vingança.;Drama,Horror,Romance,Ficção Científica;1994-11-04
A Noiva de Frankenstein;The Bride of Frankenstein;Dr. Frankenstein (Colin Clive) e seu monstro (Boris Karloff) retornam, pois não estavam mortos como inicialmente se acreditava. O pesquisador planeja parar suas demoníacas experiências, mas quando um cientista louco (Ernest Thesiger) seqüestra sua esposa (Valerie Hobson), ele concorda em ajudá-lo em criar uma nova criatura, uma mulher (Elsa Lanchester), para ser companheira do monstro.;Drama,Horror,Ficção Científica;1935-04-20
O Filho de Frankenstein;Son of Frankenstein;Barão Wolf von Frankenstein quer limpar o nome da família da desgraça. Com a ajuda de Ygor, Wolf consegue reanimar o monstro que seu pai criou. Mas quando vários aldeões são mortos misteriosamente, Wolf deverá encontrar o culpado.;Horror,Ficção Científica;1939-01-13
A Maldição de Frankenstein;The Curse of Frankenstein;"O Barão Frankenstein (Peter Cushing) descobre uma maneira de enganar a morte. Para testar sua descoberta, monta um corpo com pedaços de diferentes cadáveres. O resultado é uma criatura sem nome, irracional e sedenta de morte. Ciência ou loucura?""";Horror,Ficção Científica;1957-05-20
O Exército de Frankenstein;Frankenstein's Army;No fim da Segunda Guerra Mundial, soldados russos que passam pela região da Alemanha oriental encontram acidentalmente um laboratório nazista. Lá, cientistas fazem testes que tem como base as experiências de Dr. Frankestein, eles utilizam restos mortais de seres humanos para criar super soldados nazistas;Ação,Horror;2013-01-24
O Fantasma de Frankenstein;The Ghost of Frankenstein;Ygor ressuscita o monstro de Frankenstein e leva-o até o filho do médico original, Ludwig, em busca de ajuda.;Fantasia,Horror,Ficção Científica;1942-03-13
A Mulher de Frankenstein;La figlia di Frankenstein;Dr. Frankensteins' daughter, who is in love with the aging lab assistant Marshall, continues with her fathers experiments and attempts to transplant Marshall's brain into a new body to prolong his life.;Horror,Ficção Científica;1971-10-22
Frankenstein;Frankenstein;Primeira versão cinematográfica do clássico de Mary Shelley. O louco Dr. Victor Frankestein cria uma criatura que toma consciência de sua monstruosidade. Frankenstein, um jovem estudante de medicina, tentando criar o ser humano perfeito, cria um monstro disforme. Adoentado com o que fez, Frankenstein é consolado por sua noiva, mas em sua noite de núpcias é visitado pelo monstro. Uma luta sonha, mas o monstro, ao se ver no espelho, fica horrorizado e foge. Mais tarde, ele retorna, entrando no quarto da nova noiva e a encontra sozinha.;Fantasia,Horror,Ficção Científica;1910-03-18
A Mansão de Frankenstein;House of Frankenstein;Um cientista lunático e perigoso foge da prisão e ressuscita Drácula. Seu ato de terror vai mais além, quando ele consegue trazer de volta os monstros Frankenstein e Lobisomem, que estavam congelados e enterrados.;Horror;1944-12-01
A Vingança de Frankenstein;The Revenge of Frankenstein;O Barão Frankenstein foge da execução na guilhotina e usa o pseudônimo Dr. Stein para abrir sua clínica na Alemanha. Lá, recomeça seus experimentos com cadáveres, mas um de seus pacientes tem um destino diferente do que Stein planejou.;Horror,Ficção Científica;1958-06-13
Abbott e Costello Encontram Frankenstein;Bud Abbott and Lou Costello Meet Frankenstein;Aboot e Costello trabalham na agência de correspondências, até que ficam responsáveis por uma carga macabra: duas grandes caixas, contendo uma o corpo de Drácula, e a outra o de Frankenstein. O plano de Drácula é dar a Frankenstein um novo cérebro, e é aí que os atrapalhados amigos entram em uma fria, pois são seduzidos por uma bela garota que trabalha para o vampiro.;Comédia,Horror;1948-06-15
Alvin e os Esquilos: Encontram Frankenstein;Alvin and the Chipmunks Meet Frankenstein;Alvin e seus irmãos estão se apresentando em um parque de diversões e perdem o ônibus que os levaria a seu próximo compromisso. Com isso, ficam presos no parque e descobrem que o Dr. Frankenstein e seu monstro estão vivos.;Animação,Comédia;1999-09-28
Frankenstein - Terror das Trevas;Frankenstein Unbound;Buchanan, um cientista que vive no futuro, é levado por sua própria invenção, para uma aldeia suíça do século 19. Lá, encontra um clima de medo e terror, provocado por uma onda de assassinatos. O Dr. Buchanan vai se deparar com a chave dos crimes.;Horror,Ficção Científica;1990-11-02
Frankenstein Encontra o Lobisomem;Frankenstein Meets the Wolf Man;Lon Chaney Jr., agora um lobisomem, procura o Dr. Frankenstein na esperança de que este o liberte de sua maldição. Ele encontra o cientista morto, mas a sua criatura continua viva e causando o terror.;Horror;1943-03-05
O Monstro de Frankenstein;The Evil of Frankenstein;Once hounded from his castle by outraged villagers for creating a monstrous living being, Baron Frankenstein returns to Karlstaad. High in the mountains they stumble on the body of the creature, perfectly preserved in the ice. He is brought back to life with the help of the hypnotist Zoltan who now controls the creature. Can Frankenstein break Zoltan's hypnotic spell that incites the monster to commit these horrific murders or will Zoltan induce the creature to destroy its creator?;Horror,Ficção Científica;1964-05-08
Frankenstein;Frankenstein;A história se passa nos Estados Unidos de hoje, quando a detetive O´Connor está investigando uma série de horripilantes assassinos. As pistas a levam até uma figura misteriosa, Deucalião, criação original do Doutor Frankenstein que, através de experiências genéticas, tem-se mantido vivo nas sombras. O próprio doutor Victor Frankenstein, hoje conhecido como Victor Hélios está vivo e aperfeiçoando sua técnica de trazer vida aos inanimados. Suas criaturas, mais sofisticadas que Deucalião, estão em todos os setores da sociedade, sob o controle do mestre. Médico e monstro fizeram diferentes escolhas entre o bem e o mal. Agora, com a ajuda de Deucalião, a detetive O´Connor tentará apanhar Hélios e provar seus bizarros crimes. Mas ela terá que arriscar sua própria vida para fazer isso.;Drama,Horror,Mistério,Ficção Científica,Filme para TV;2004-10-09
Frankenstein Contra o Mundo;フランケンシュタイン対地底怪獣;During WWII, Germans obtain the immortal heart of Frankenstein's monster and transport it to Japan to prevent it being seized by the Allies. Kept in a Hiroshima laboratory, it is seeming lost when the United States destroys the city with the atomic bomb. Years later a wild boy is discovered wandering the streets of the city alone, born of the immortal heart.;Horror,Ficção Científica;1965-08-08
O Horror de Frankenstein;The Horror of Frankenstein;Tongue-in-cheek chiller about a ruthlessly sadistic student who will stop at nothing in pursuit of advancing his shocking scientific experiments. Young Victor Frankenstein murders his own father in order to inherit his title and fortune, and drops out of school to concentrate on his unholy attempts to resurrect dead creatures.;Horror,Ficção Científica;1970-11-08
Drácula de Bram Stoker;Bram Stoker's Dracula;O vampiro Conde Drácula vem à Inglaterra atrás de quem ele acredita ser sua antiga paixão, de quando ainda era um mortal.;Horror,Romance;1992-11-13
Conde Drácula;Nachts, wenn Dracula erwacht;Jonathan Harker viaja até um castelo numa remota zona da Transilvânia para encontrar-se com seu excêntrico proprietário, o Conde Drácula, que pretende comprar uma nova propriedade na Inglaterra. Aos poucos, Harker começa a perceber que há mais do que excentricidade naquela figura, e seu anfitrião se revela uma terrível criatura que se alimenta de sangue humano.;Horror;1970-04-03
Keanu Reeves, messie pop;Keanu Reeves, messie pop;Revealed in independant movies such as My Own Private Idaho, blockbuster movie star in Point Break and Speed, hero of the digital era in The Matrix, virtuoso killer in John Wick, Keanu Reeves is one of the most intriguous stars of his generation. However, after 25 years in the spotlight, he stays an enigma whose chaotic career seems to go on without a guilding principle. Today, nobody could question his unique status as he reluctantly became a social network icon, and a role model for the « woke » generation.;Documentário;2022-12-17
Die Keanu Reeves Story;Die Keanu Reeves Story;;Documentário;2023-03-20
Keanu Reeves: Journey to Success;Keanu Reeves: Journey to Success;No actor's private life is more guarded and more mysterious than Keanu Reeves. Within it rests a world filled with rumors and tragedy, love and loss, fortune and fame. But now for the first time ever, the mysteries will be revealed and the rumors put to rest in 'Keanu Reeves: Journey to Success'! Through interviews with Keanu Reeves and his costars, movie premieres, and film clips, experience firsthand the secret life of one of the most mysterious actors in the world: Keanu Reeves.;Documentário;2003-10-01
Tom Cruise: Um Jovem Eterno;Tom Cruise: An Eternal Youth;Após 40 anos, Tom Cruise continua a inovar no cinema. Expor o coração de alguém ao mundo por meio de seu trabalho não é apenas um negócio arriscado, para Cruise, é a única maneira de alcançar um fim que parece completo.;Documentário;2020-10-05
James Corden's Top Gun Training with Tom Cruise;James Corden's Top Gun Training with Tom Cruise;"When ""Top Gun: Maverick"" star Tom Cruise calls you up to hang out for the day, you say yes. And for James Corden, that meant having Tom pilot you in two different fighter planes, pushing the limits of gravity and James's stomach.";Ação,Comédia,Documentário;2022-06-01
Tom Cruise: The Last Movie Star;Tom Cruise: The Last Movie Star;Tom Cruise - actor, producer, daredevil. The face of Hollywood in the 1980s, after a mid-career meltdown, his future looked in doubt. But through a single-minded commitment to entertaining audiences worldwide, he has risked life and limb and fought his way back to the very top. In an entertainment world dominated by superheroes and fantasy franchises, he stands alone… the last movie star.;Documentário;2023-07-28
Tom Cruise: Impossible Missions;Tom Cruise: Impossible Missions;The stories behind the most memorable stunts from the film franchise, from the genre-defining Langley Heist to the jaw-dropping Plane Hang;Documentário;2023-07-08
Le Système Tom Cruise;Le Système Tom Cruise;;Documentário,Filme para TV;2023-06-20
Untitled Tom Cruise and Christopher McQuarrie Action Film;Untitled Tom Cruise and Christopher McQuarrie Action Film;"An ""original action film with franchise potential"" by Christopher McQuarrie and Tom Cruise.";Ação;
Untitled Tom Cruise and Christopher McQuarrie Musical;Untitled Tom Cruise and Christopher McQuarrie Musical;"An ""original song and dance-style musical"" by Christopher McQuarrie and Tom Cruise.";Musical;
Cruise Cat;Cruise Cat;Tom is the official cat on the cruise ship S.S. Aloha, but he'll be kicked off if the captain finds even one mouse. That one, of course, is Jerry, who sneaks on board just before sailing.;Animação,Comédia;1952-10-18
